{
  "$schema": "https://json-schema.org/draft/2020-12/schema",
  "$id": "https://agentic-automl.local/benchmark/run-manifest.schema.json",
  "title": "BenchmarkRunManifest",
  "type": "object",
  "additionalProperties": false,
  "required": ["schemaVersion", "runId", "suiteId", "git", "artifacts"],
  "properties": {
    "schemaVersion": { "const": 1 },
    "runId": { "type": "string", "minLength": 1 },
    "suiteId": { "type": "string", "minLength": 1 },
    "git": {
      "type": "object",
      "additionalProperties": false,
      "required": ["branch", "commit", "dirty"],
      "properties": {
        "branch": { "type": "string", "minLength": 1 },
        "commit": { "type": "string", "minLength": 1 },
        "dirty": { "type": "boolean" }
      }
    },
    "artifacts": { "type": "object" }
  }
}
